,post_id,comment
205,9fpksx,"Yes of course emails all the time 24/7 there is literally nothing else in the world going on. Trump isn't giving massive donations (oh sorry tax cuts) to the rich, dismantling the EPA, creating social chaos, taking bribes from foreign countries (oh sorry those are totally unrelated business deals), obstructing justice... Hold on this just in ""Trump shoots unarmed black woman in cold blood. Now Hannity with his top story on crooked Hillary and her missing email"""
206,9fpksx,Of course it's fucking weebs and neckbeards here.
207,9fpksx,What *IS* this creepy obsession with Yaoicon and manga chanboards these middle-aged alt-righters have???
208,9fpksx,h
209,9fpksx,"You can't act morally superior when you are a AHS user, it's literally the lowest of the low

Everyone else at least has fun with what they do"
210,f6mxna,He feels more like a reptilian to me
211,9in8tu,This is nice but what does it have to do with politics? This is just about racism
212,9in8tu,Yes he is a hero... too bad Drumpf doesn't know how to treat anyone like a human being other than Putin an Kim Jong Un.
213,9in8tu,"This has everything to do with politics. 

We live in a nation that responds in the most extreme way to a difference of opinion. We take any slight on us or our beliefs and give 100% outrage back. The problem is, if we are outraged over everything, how do we know if ANYTHING is actually worth being outraged over? This man took the problem this nation has and flipped it on its head. A black man should have every reason to throw down with a member of the KKK and tear him apart. But he chose to do the one thing no one in this country knows how to do anymore: LISTEN. try to understand and ask questions. Discuss the things that make us similar until we come to figure out why we’re different. Many times, the answer is so small that we can walk away from a conversation with a completely different world view. Politically, we chose hatred over love. Spite over understanding. Violence and manipulation over discussion. This man is an example of how tremendous our country can be if we lower the damn volume for once."
214,9in8tu,"Of course rascim has nothing to do with politics. Imprisoning toddlers, Muslim ban, ICE...no no of course like they say on fox news Rascim does not exist."
215,9in8tu,I love this! But now I think this is too underrated and should be on r/rebublicans too
216,9in8tu,Ikr the Democrat subreddit just banned me for a difference in opinion
217,9in8tu,"Listen my friend. I'm a Mexican immigrant. I've been there and I understand both sides because I know English. 

When I came into the us I was being helped by English speakers who got me to learn English. I was at the wrong place at the wrong time and u got detained and had to translate for ICE and the other detainees until my trials (turned out okay).

Most of the immigration issues have no other proper solution. ""Imprisonment of toddlers"" is a terrible way of saying it. The only scary part was having big white dudes trying to talk to you in English, unknown to them wether you were going to act up and fight for no reason or let ICE do their job.

The Muslim ban. I didnt like it, but the French didn't act up about immigrants and look at how many terror attacks they've had recently.

Racism is a social issue, not a political issue."
218,fe8rf7,[deleted]
219,fe8rf7,"You're right on most counts. The Electoral College dates back to the debate between popular representation versus equal voting weight. The problem isn't the E.C. but the way the states (most, anyway) have a ""winner take all"" rather than an apportionment of the popular vote within each state. If all States apportioned their votes then the EC would very closely follow the popular vote.

Anyway, the parties control things to their own advantage. Most third parties absolutely don't try to win a national election. All they're trying to do is hit the magic number of 5%. At 5%, the funds that people check the box to donate money to the Presidential Campaign Fund is unlocked. So, with every donation of $3 / taxpayer, the parties strengthen their control over everything. No third parties can access that cash windfall while the GOP and DNC each get equal amounts from it.

Primaries, IMO, should be done along Senate lines with ~1/3 being voted upon in three national primary days. They would need to be staggered slightly from the Senate races in the current year to avoid an imbalance of power among states, but I would like that system.

Finally, the Primary system itself is actually a construct of the two party system because having multiple candidates on general election day would result in potential chaos or the election of a minority candidate like Bernie Sanders. The Primary system is designed to lock out people like Bernie or other fringe candidates or third party candidates from winning. The Primary to general election cycle is created as a means to ensure that ""Democracy"" is anywhere from limited to mostly eliminated."
220,fe8rf7,That's the problem. They think you can't win with a popular candidate. Or rather they don't want to win with a popular candidate because it doesn't maintain the two party duopoly.  When you have a popular candidate you might actually expect folks to show up and vote instead of our appaulingly low turn outs.
221,fe8rf7,"Thanks for the detailed response, I was beginning to think I was the only one who cared.  When you say 1/3 being voted upon do you mean 1/3 of the candidates?  Or more like one third of the states voting?  If the latter would you have them randomly pick which states when?  And why not all the same day because I don't really get the point of staggering, it just encourages voter apathy and fatigue.

I'm totally in with the two party monopoly. In that exists, not that I think it is a good idea. There was a Freakanomics podcast episode all about it and that it is an actively managed construct sounds highly plausible to me.

I think having a strong third party - or more - is probably the only way to ensure democracy where we all get some representation instead only about 50% and even then let's not kid ourselves either party is really serving us. It's the money they serve."
222,fe8rf7,"Partially true. Elections are popularity contests. Bernie's very popular with college age people and a bunch of quite reactionary type people. They've decided, apparently, that capitalism hasn't worked, so socialism needs to be implemented. And Bernie's policies would require a taxation level nobody in the USA wants to see. Ol' Joe is not only ""damaged goods"", but he's not really as sharp as he may once have been. He's popular with most Democrats...compared with Bernie's policies and tone. He's the ""safe alternative"". Both have tried to be POTUS and both have previously failed to even win the primaries.

All the Democrats had to do, is find someone who can beat Orangemanbad, and they came up with 2 failures..."
223,fe8rf7,"1/3 of the states vote in three waves. It would permit the candidates to get out to the States and visit voters.

That's the way the Senate is elected (1/3 every two-years). However, to prevent larger emotional swings the states voting should not be the same cycle as the Senate because an outsized influence in a given election cycle would exist--electing both Senators and the President in the same year with large influence on both. So, at a minimum, the active Senate elections should be in the last wave of the three stage of voting rounds."
224,fe8rf7,"first. Why are you here? 

We realized that mixed economies work better. We want to prop up capitalism where it works and kill it where it doesn't.  You know.. Doing the logical thing.."
225,fe8rf7,"Hmmm...well I suppose the answer would have to be, to discuss what's wrong with the Democrat Party, and even suggest ways to improve the party. That does happen to be the purpose of this sub...no?

Why are you here?

To ""kill it where it doesn't"" according to...you?"
226,fe8rf7,"Ok. let me clarify.   
You are a conservative. No?"
227,fe8rf7,"I moved to the right when I realized a bunch of silly reactionaries called Progressives had hi-jacked Liberalism.

You want to attack capitalism where you figure it doesn't work. That sounds rather...Progressive to me."
228,fe8rf7,Are you ok with the actions of the reactionaries on the right?
229,fe8rf7,"No. I'm not ""ok"" with any reactionaries. Left or right."
230,fe8rf7,But the ones on the right are easier to bear with?
231,7ddfah,This hurts.
232,7ddfah,"The right-wingers are losing their minds and crying for him to resign, which is in sharp contrast to their handling of the accusations against Moore and Trump, obviously.

We should believe women. That shouldn't be a partisan issue."
233,7ddfah,"I am not a democrat, but we should stop destroying people’s life  over alleged claims. Yes we should give  moral support to victims. Unless there is a strong evidence or admit, we should not go after alleged preps. We should stop at providing moral support. "
234,7ddfah,"""When you're a star, you can just go up to women and grab them by the boobies."" ~ Al Franken"
235,7ddfah,"This is the best tl;dr I could make, [original](http://thehill.com/homenews/news/360656-woman-accuses-al-franken-of-kissing-groping-her-without-consent) reduced by 87%. (I'm a bot)
*****
> A TV host and sports broadcaster on Thursday accused Sen. Al Franken of kissing and groping her without her consent in 2006.

> Leeann Tweeden accused Franken of groping her, without her consent, while she was asleep and provided a photo as evidence.

> &quot;On the day of the show Franken and I were alone backstage going over our lines one last time. He said to me, &#039;We need to rehearse the kiss.&#039; I laughed and ignored him. Then he said it again. I said something like, &#039;Relax Al, this isn&#039;t SNLwe don&#039;t need to rehearse the kiss.&#039;&quot;.


*****
[**Extended Summary**](http://np.reddit.com/r/autotldr/comments/7ddl30/woman_accuses_al_franken_of_kissing_groping_her/) | [FAQ](http://np.reddit.com/r/autotldr/comments/31b9fm/faq_autotldr_bot/ ""Version 1.65, ~248072 tl;drs so far."") | [Feedback](http://np.reddit.com/message/compose?to=%23autotldr ""PM's and comments are monitored, constructive feedback is welcome."") | *Top* *keywords*: **Franken**^#1 **wrote**^#2 **photo**^#3 **kiss**^#4 **sexual**^#5"
236,7ddfah,"Trump said nasty things, but is there a proof that he actually did it? "
237,7ddfah,"This woman's story doesn't stand up. She claims she was groped...she's wearing an armored vest in that picture. If she lied there, should we believe her other story?"
238,7ddfah,I guess that works in the Roy Moore case (he did it) but not the Al Franken case where there's a pic.
239,7ddfah,There’s literally a picture. 
240,7ddfah,If people could stop being disgusting human beings that would be great. I think both (Moore and Franken) are guilty. There is never a reason for this type of non consensual behavior. 
241,7ddfah,"""When you're a comedian, you can just go up to a woman and mime grabbing her boobies through half an inch of bulletproof padding, everyone will laugh, and then when it seems like a politically convenient moment, she will shriek that she was abused."""
242,7ddfah,"Over 20 women have said he did, including allegations of rape and statutory rape. "
243,7ddfah,"The picture is obviously a really poorly thought out prank/joke. He might not be touching her, even, but it’s still something that shouldn’t have been done. 

As for believing her, that’s up to you. I was highlighting the disproportionate response among conservatives who are calling for Sen. Franken’s head for this while ignoring more numerous and more serious allegations against Trump and Moore. 

edit: typo"
244,7ddfah,"There's a photograph that doesn't support her actual accusations that she claims is in the photograph. She is clearly not being actually physically groped in that picture like she claims it to. Is it distasteful? Absolutely, but doesn't support what she's saying, and has already started her accusation with a blatant lie.

Also, OP, wtf is with this comment? 

> If you're a straight male and you say you wouldn't I question your believeability.

Sexual assault isn't OK regardless of what gender you are or what gender is doing the assaulting. "
245,7ddfah,It's ok done to me by someone that looks like Kate Upton. You're not the arbiter of what's ok for me.
246,7ddfah,"Since you're so informed about the whole thing, did he also try to stick his tongue down her throat?"
247,7ddfah,"What you want done to you is between you and whomever. You explicitly say you wouldn't believe any guy that would call sexual assault, though. That's a different story altogether. "
248,7ddfah,"I don't know, I wasn't there, but if she is already verifiable lying then we owe it to everyone, especially victims who have been silenced by false accusations, for more information to come out. If her accusation is true then there *has* to be corroborating evidence. Someone who can confirm they were alone together, a copy of the script asking her to kiss him, someone who heard her scream at him. This didn't exactly happen at a private affair. This was an open event for the military. "
249,7ddfah,Didn't say that. I said I'd be happy for her to sexually assault me. Most males would. Big difference between the power of men and women.
250,7ddfah,"You did say it, I quoted you. You are a sick individual that thinks someone's genitalia lends more credence to their believability than whether or not they're actually lying about verifiable events. "
251,7ddfah,Thanks for telling me what's right for me. Mind if I take you so I can get your correct directions for my life on future issues? Thx in advance!
252,7ddfah,"Again, as I said before, you do you. Just please stay off any jury where a man is accusing a woman of sexual assault. In your own words, he would be hard to believe for you. "
253,7ddfah,If you're a straight man I doubt your honesty.
254,5e7giz,"Ahhh Bernie, love that guy. Still tilting at windmills"
255,esnjqg,"Bernie, Amy, Elizabeth and Michael are WHINs - whites, Hispanics, and/or Natives... WHIN Pride (white, Hispanic, Native) Pride.[We Like Women Pride Army](http://sites.google.com/site/thewelikewomenpridearmy)"
256,k10av,Me too!
257,k10av,"I apologize for responding to a 2-day old submission (which by reddit standards is ancient) but,

>I truly believe that I speak for so many young progressives that would be proponents for peace, clean food and water, and a government that actually helps and cares for its citizens.

Hey that's great, but that's not what Ron Paul has on tap. The rest of the article is nothing but glowing praise for Ron Paul, sans citation.

If you sincerely know of and advocate Ron Paul's positions, then you were a fool if you voted for Obama in the past presidential election. It's great if you have since found something that more closely matches your views.

This HuffPost (heh?) post would've been more sympathetic of the poster had said, ""This time, it's a McKinney/Moore/Kucinich/Gravel challenge or nothing!""

Nobody who is anything but woefully ignorant goes from Obama to Paul."
258,ieo2th,"Finally, some defiance and patriotism by doing what’s *right*"
259,ieo2th,"Seems like an easy fix. 

Fire them."
260,fczua6,Fuck Biden for separating the democrats. Who in the right mind would vote for someone who says that marijuana is a ‘Gateway Drug’?
261,fczua6,The debates are going to be gooooood.
262,fczua6,at this point Trump would have more competition with another Republican
263,fczua6,"Sanders - Calls himself a ""Social Democrat"". His platform would require such high taxation that it would resemble Communism. Result - Trump win.

Biden - Has serious issues with his habitual use of his position, to enrich his family and friends. Also has some serious gaff issues. Result - Trump win.

The Democrats really should have not let their anger and hatred, drive them to this mess."
264,fydz16,"Brainwashed zombies indeed! They'll vote for anything with an R next to it to their own peril.

This tribal mindset is getting worse and worse each election and currently their drunk on their power spewing out their alternate reality babble.

I have so many words to write.. yet I'm speechless as everyday they cover the last with new drama.. And it's all planned!
Say what you want now and fire up the base with B.S because they dont fact check nor will they recall or care what was said because theirs a new mountain of lies on top of that.

They've become accustomed to being lied too but it works in their alternate reality, You cant show them charts, graphs or anything factual, They wont even look because it doesnt fit into their world of lies. How do you live your life not knowing the truth or facts? Can their minds not handle it? Is it too much.

Their being led by their party mimicking their church practices, Dont question what your being told. Dont believe your lying eyes! Gerrymandering.. voter suppression.. stealing elections!!

What has America become.. No one needs to invade you all your tearing yourselves apart. Luckily your a continent away from everyone else and you only have to worry about the corporate invasions on your wallets. 

Republicans rob and loot and then Democrats clean it up and keep it stable, Republicans get the economy going red hot and cause a crash and Democrats clean it up. 

My mind sees it's all pre planned, You know their making money off of these pre planned crashes. Then their bailed out and the middle class is decimated once again. 

I talk to Republicans who claim Obama caused the last housing crisis, He wasnt even in power!! He repaired it after Bush left!! The stupidity of these people to not research facts but it doesnt matter to them..

Where is all this leading?.. Is the point to get all Democrats and independents to throw their hands up in the air and quit and let Republicans control the military and bring about their end of the world scenario. 

You know that's what they think.. They spend like theirs no tomorrow yet whine when Democrats spend anything to further everyone. Who wants a stable world full of happy people. Jesus wont return in those conditions"
265,fydz16,"Welcome to the side of normal people, OP

A good metaphor I heard once was that republicans are like zombies, and it's especially true now."
266,fydz16,"I didn't vote for Trump, but I'm Canadian so...

I sit up here though, reading US opinions and watching this war go on. It seems to me, that Donald J Trump evokes such a negative emotional response from so many people, that it resembles some sort of spell.

I also see the base of the Republican Party basking in Trump's presidency. Wallowing in his unpolitical personality and his nationalistic policies. It amazes me that the religious right is able to stand behind this guy, who's left a trail of fairly unholiness in his wake throughout his life. But...follow they do. Why? Its actually incredibly simple. In fact I also think its the simplicity of Trump's base appeal, that produces such unbelievable frustration in Democrats.

MY NATION FIRST! MAKE AMERICA GREAT AGAIN!

Democrats...the people want a rational and beneficial response to the blood-letting that Globalist policies have imposed on the American middle-class...and indeed the middle-class of the entire western world.

Ya know...were the Democratic Party able to find a candidate who can make American's their primary concern, and express that openly and proudly...you'd win.

Simple as that."
267,fydz16,I've heard more of the same for the other side. Politics and tribalism makes people zombies.
268,fydz16,">were the Democratic Party able to find a candidate who can make American's their primary concern, and express that openly and proudly...you'd win.

TBF, we've done that over and over and over again, but the republikkkans have the wealthiest, stupidest generation in HISTORY (white american boomer christians) under their command."
269,fydz16,"> the republikkkans have the wealthiest, stupidest generation in HISTORY (white american boomer christians) under their command.

Thank you...for your racist, bigoted, drivel."
270,fydz16,r/Persecutionfetish
271,fydz16,So is that your favourite haunt?
272,fydz16,"""Saying boomers are wealthy is racist""

\- morons"
273,fydz16,">white american boomer christians

Try not lying quite so much.

Your comment was extremely racist.! Now go kick a dog. You'll feel better."
274,fydz16,Oh poor white american boomer christian! Being in control of everything is too hard for you???
275,fydz16,"I control what needs controlling, within my sphere of influence. That's because I have responsibilities and benefits that I have worked for. That bothers you. Oh well...

BTW...not Christian but, Happy Easter anyways..."
276,i5o819,"Actually it looks like trump* about to rape a [13 year old girl](https://www.courthousenews.com/rape-allegations-refiled-against-trump/) and laughing because epstein gets sloppy seconds.  You can tell by the mushroom shape...

Hopefully the child went on to put behind the trump* rape and had a normal relationship with a man with 

with

with

a normal appendage

(EWWWW, That link above was hard to read, right?)"
277,i5o819,Is this sub just a trumptard cingefest now? Where are the mods?
278,gvuze7,"I'm going to be honest, I don't get it."
279,gvuze7,The ants had to riot to get their way. Just making a cheeky comparison. Trump wants us to think that he’s such a badass who is untouchable. Clearly the world is showing us that we aren’t as small as trump would like us to think.
280,f11ks0,"I just don't see how nominating a Republican is a good move for Democrats.

Just from a politics standpoint, the resurgence of the GOP over the last 40 years isn't because they ran to the middle.  Success will always be about firing up the base, and I don't see some Billionaire doing that."
281,f11ks0,"I personally don’t see the big deal with him being a billionaire. It’s a problem with the system, not the candidate. He’s been a decent mayor other than the stop and frisk, and has great proposals for gun control and climate change, which I consider the two most important issues at the moment."
282,f11ks0,"TBH, I'm not threatened by the idea of making a boring billionaire with no personality disorders president.

I mean, I know I'm the dog in the ""this is fine"" meme, but frankly, Bloomberg is a very normal person. I mean, of course I don't like the stop and frisk stuff... but I think he is trying to make peace with that. It seems that he realizes his former republican self was a little too much.

This is just my opinion. I'm going to vote blue no matter who."
283,f11ks0,"Wanna stop drunk drivers from killing sober drivers? Ban sober people from driving. That’s basically what Dems want out of gun control. Tell me how it makes sense, please?"
284,f11ks0,"Thank you so much for your insight. I don't think he's a bad guy, the fact that he owns a media company does worry me a bit. He's never been my guy, I'm a Bernie fan myself, but he seems to be putting a ton of money into the race and gaining ground. I will also vote blue no matter what. We have to!"
285,f11ks0,"That’s quite the strawman. No, most dems are looking for more comprehensive checks and controls on who can buy guns. In any case, I think there is a problem with guns being viewed as a human right, but that’s another separate issue."
286,f11ks0,"I'm glad my insight was useful! He's definitely not my first pick either: I like Bernie alot too.

The only nominee that would be truly awful if they got nominated is Gabbard. She is a bad faith candidate - some kind of russian troll."
287,f11ks0,Gabbard won’t last very long at this rate
288,eyjyfx,A little copy and paste can convey a bit more sincerity
289,ecewvb,"Wishful thinking, unfortunately."
290,au4p2g,"I mean bfwilley has the right to be conservative, but if this isn't a sub for democrats why the fuck is it called /r/Democrat? "
291,au4p2g,The anime background makes it looks like it is run by a 13 year old boy.  Seriously mods this needs to go.
292,au4p2g,Lol that's the point. It's radically centrist to point the flaws of the Democrats out here.
293,au4p2g,I've been confused about why this sub exists for some time. It feels like r/Republican here but the memes here are even worse.
294,au4p2g,Bc it's not a safe space. 
295,au4p2g,Then you shouldn't call it /r/democrat.
296,au4p2g,Lmao wat?
297,au4p2g,"No one's asking for a safe space, just that the sub fit its name"
298,au4p2g,"Well, maybe you should post in /r/democrats . this sub is for pointing out the flaws in the party :-)"
299,au4p2g,Its about democrats tho
300,au4p2g,"Don't get me wrong, I fucking hate the democrat establishment, but at the same time this sub isn't about criticizing dems it's just filled with completely conservative bullshit."
301,au4p2g,"I mean, the goal was to make the posts be subtle in their criticism, but its a lost art form :-)"
302,aiud6m,They’ve become unwatchable. I would guess they fell into Trump’s “fake news” trap and are doing their best to both-sides everything to death.  
303,aiud6m,Sure...its CNN's fault this president pulls a different stunt or lie every single day that needs to be fact checked and you want to blame the people trying to keep him honest.? What planet are you people from?
304,aiud6m,"You could say the same thing about Fox when Obama was President. While CNN does lean left, I think they give a fair voice to conservative view points, unlike Faux who has their hosts and commentator scream over the one or two liberals they allow on their shows. "
