,post_id,comment
396,fxjp1i,"> I’m not defending Bernie but isn’t that exactly what this $2 trillion bailout has done?

No...it isn't the same at all. For one thing, this ""bailout"" does not gather power and control to the government. It finances a part of the nation in a time of extreme hardship.

> And wouldn’t Medicare for all end up saving taxpayers money?

I think it would. But you can't demand it all at once. This needs to be done incrementally.

> We also have 60% of our national budget towards military and it’s growing. We can certainly throw a percent or two of that our way and that would save us a few billion. 

You can make a good case for that. I don't know how the general public would feel about it though. America loves its military might, and the nation is able to use it as a bargaining chip...which is a plus.

> I’m a small business owner. I pay taxes through the nose unlike massive corps but I’m ok with it because it supports my community and my country. The USA doesn’t have a taxation problem as much as it has a budget problem but frankly both. I guess what I’m trying to say is that I think we can bring the best minds in the country together and critically think through & solve the problem without succumbing to previous problems faced by other countries.

I'm a small business owner too. One man show in fact. And I know that what you say about taxes is true. OUCH and a half. And I too am good with paying, as long its not being wasted on silly crap.

Its not the desire to ""even the playing field"" for the middle class, that anyone objects to. With Bernie, AOC and the like, its the down right demand that all change now. Its also that friggin' brainless Green New Deal."
397,fxjp1i,"$2T? They literally threw a trillion a day at the stock market. No fanfare, no discussion, just started shovelling money at it. When it's something important like the stock market, nobody asks questions about the deficit. $30T so far and counting."
398,fxjp1i,ROFLMAO...ya ok...
399,fxjp1i,"Yes we saw how Obamacare was...cheaper...

You are being completely disingenuous as you ignore the devistration the his Green new Deal would bring."
400,fxjp1i,"What Ohio is not a solid blue state, in 2016 Ohio voted Trump, in 2008 and 2012 Obama, in 2000 and 2004 Bush, Ohio is the exact definition of a swing state."
401,fxjp1i,Ohio is always listed as a solid blue State very much like Florida. They never change...
402,fxjp1i,LOL Ohio is a swing state
403,fxjp1i,"I have no idea where you get that from.

Nearly every poll or analysis I’ve seen has Ohio as swing or leaning R."
404,fxjp1i,Lol yeah it doesn’t even matter. It’s a protest vote anyway. Cuz if the DNC is manipulating the candidates then that’s not right.
405,fxjp1i,I love your username
406,fxjp1i,Thank you for your great responses to each of my points. Change is tough. And bringing it on incrementally may be our best bet. We are a young nation and are constantly trying to improve. Hopefully we can just keep getting better and not fall like the Romans.
407,fxjp1i,"Obamacare was way more expensive and was designed to entrench and enrich insurance companies.

The Green New Deal.... would be devastating NOT to pass."
408,fxjp1i,"Obamacare was way more expensive and was designed to entrench and enrich insurance companies.

The Green New Deal.... would be devastating NOT to pass."
409,fxjp1i,"Joe Biden’s the most electable candidate we’ve had in decades, so Ohio’s a definite lock. Looking forward to being able to vote my conscience guilt-free."
410,fxjp1i,I love you both
411,fxjp1i,"You're quite welcome. And change is tough. People naturally want to resist. Some more than others. A form of Obamacare would work, as long as it was open and that each state could decide for its own, whether to allow it or not. As about a decade goes by...they'll all get signed up. Just the way we did it in Canuckland...which is even younger than your nation.

Don't worry about the Romans...they were Roman. You're American. That's different. Better some would say. What's important...IMO...is that whatever track the USA, and especially my own nation, take, it needs to be done in the name of the actual and measurable benefit of OUR OWN NATIONS...respectively."
412,fxjp1i,"Oh my...a ""greenie"". The Green New Deal is nothing more than a power gleep. I grand lie designed to have the population willingly hand over everything. The people who propagate this grand lie...need a gawd-damn spanking!"
413,fxjp1i,"No way is Ohio a lock to go blue. Trump won Ohio by a little over 8% in 2016, the last time anyone won the state by over 5 points was Clinton in 96. You have to go back to 88 to find a president who won the state by more than Trump did in 16. If Dems show up to vote in November Biden should win but I would hardly consider him a lock."
414,fxjp1i,"Oh my.... a group that actually will work for single payer and try and avert disaster.

The same way you guys are lecturing Republicans about ignoring pandemics.... stop ignoring climate change."
415,fxjp1i,"Disaster? What disaster? The climate changes...so what? If it scares you so much, don't buy a house on a coast. But don't expect people to flock to the absolute destruction of the global economy for...lies and absurd doom's day predictions...that never come to pass..."
416,fxjp1i,"> Disaster? What disaster? The climate changes...so what? 

Stopped reading here.

Pandemic? What pandemic? Stop reading Michael Creighton novels, LOL. NOT."
417,fxjp1i,"Yesss...close your eyes, stick your fingers in your ears and go...""LaLaLaLaLa""

Enjoy your fear and misbegotten ideas."
418,ej4ypj,this I why its important to be careful when getting news from social media
419,ej4ypj,"If you want something even worse, read about how YouTube is radicalizing people to violence and psychologically training pedophiles through their algorithm."
420,4ubk4u,"If we end up with a Trump presidency the DNC has no one but themselves to blame. Fact is Hillary would have probably won clean, but this shit will do real damage."
421,fbuw6y,Well obviously these raffles are for the kids to get class trip money etc. Tickets are sold to anyone but you still have to go thru the process (background check) to get your prize.
422,fbuw6y,"I grew up in Idaho, which is where this appears to be from googling the sporting goods store. This is all very normal for countryside communities.  Most of my friends and I took hunter's-safety courses around 5th grade, and many of us had our own guns or access to the family's guns at those ages. You can be concerned, but people are allowed to decide what is risky for their children. Riding horses and farm-equipment accidents were responsible for far more injuries to people I knew than anything gun-related.

People sell raffle tickets for things people want.  Obviously this is a community where a good rifle is seen as valuable.  People in the country look at guns as tools and recreational equipment.  It's sold from a sporting goods store, not a black-market arms dealer."
423,fbuw6y,If your from a rural area you would know this is normal for schools to do my middle school had hunting competitions
424,fbuw6y,Lol it’s a bolt action anyways
425,fbuw6y,"I have had a hunting rifle or shotgun ever since I was 14, being a gun owner doesn’t instantly turn you into a republican. I have voted democrat or independent every time I could. A responsible 5th grader that attends a gun safety course, is safer than most adults with a gun."
426,fbuw6y,I have to wonder...which would be worse? Having a little 22 for gopher shooting and learning to handle a firearm? Or getting handed a 44 handgun in Chicago and told to defend your turf?
427,fbuw6y,It's a hunting rifle. Don't be a dumbass.
428,fbuw6y,Considering that most NRA nut jobs and rednecks don't go beyond third grade this must be some type of incentive to stay in school and they can say they have advanced education.
429,fbuw6y,"So today my sister told me her 5th grade class is having a raffle and that I should buy a ticket. I then asked ""well, what is the prize if I win?"" I was a bit ""caught off guard"" when she said, ""it's for a huge gun, a rifle""

&#x200B;

I'm having a difficult time deciding whether this is right or wrong. Please tell me what you think?

&#x200B;

My sister is 10 years old, in 5th grade, and attends a private Christian School. I'm just curious... Did the students decide what would be Raffled? A teacher? The PTA? 

THERE'S AN ENDLESS AMOUNT OF POSSIBILITIES THAT WOULD MAKE A GREAT PRIZE... WHY A RIFLE OF ALL THINGS????

&#x200B;

Can't forget the best part, here is the flyer/envelope that was sent home with all the kids to collect money from neighbors and other members of the community."
430,fbuw6y,I'm extremely pro-gun but this seems inappropriate even if it's a private school
431,fbuw6y,I don’t think a school would raffle this especially a elementary school but ya know anything to fit the narrative.
432,fbuw6y,"Huge gun? Hyperbole only exacerbates the other side of the aisle. Most pro gun folks are going to call you out for being ignorant if you focus on things like “huge gun”-when it’s like 44-50” max(smaller for rifles)
And you are given the option to take a 500$ gift card.

So, if I understand this correctly, you think that you should have control over what someone donates for a raffle?

Or, are you angry that someone may get a gun without proper credentials?-bc that’s assuming a lot between winning and getting a gun, in hand.

Or, would you have them NOT accept a prize from a pro-gun store such as Dicks sporting goods or Academy sports? 

Or, guns and school being used in the same sentence shakes you to the core and you came to reddit where similar unhinged outrage is a normal, and you want-nay, NEED 
 your ECHO(echo) CHAMBER(chamber)"
433,fbuw6y,"
>THERE'S AN ENDLESS AMOUNT OF POSSIBILITIES THAT WOULD MAKE A GREAT PRIZE... WHY A RIFLE OF ALL THINGS????

I posted a longer comment on the overall thread, but just to address your question - because people raffle things that have a proven track record of getting a lot of tickets sold.  So obviously you live in an area with a lot of people who hunt or enjoy recreational shooting.  They're not trying to promote a political ideal, it's purely about fundraising.

What type of raffle prize do you think would likely sell more tickets in your community?"
434,fbuw6y,"Are you in Idaho as others have suggested? If so, there do not appear to be requirements to the registration for transfer of long guns (rifles, shotguns, etc.)."
435,fbuw6y,Really? 500$ gift card to sporting goods store? You read that you have options if you win
436,fbuw6y,It also depends on where you live. Our schools closed for the first day of buck season.
437,fbuw6y,Well the gift card to the sporting good store is a great idea that way the winner can decide to buy a rifle or buy camping gear. And I honestly don't care either way I was just trying to stir the pot LOL that's what Reddit is all about right lol. It did however make me think though which I don't do much of being I from Idaho.. Kidding
438,fbuw6y,"Haha oh yah, I always appreciate some pot-stirring."
439,by8yvf,"The right wing propaganda coming from a page called ""Democrat"" is why reddit is a shithole and not a bastion of honesty."
440,be2j3a,"They ought to be honest and just add a rule that says ""posting positive information about Bernie Sanders will be punished with a ban."""
441,be2j3a,"i got banned from beto 2020 for asking questions , trying to start a discussion, debate 

&#x200B;

so i guess we cant talk or do anything contrary to their ideas  even if its logical, true and simply asking for info"
442,be2j3a,What is the point of people trying to talk if you won't let them talk? That is the whole point of Reddit to talk. Why ban people for having a different opinion than you or people trying to have a real discussion on things. Why ban people for trying to get a discussion started let alone a debate?  Are the Moderators afraid of harder questions then on a CNN panel?
443,be2j3a,Maybe the admins are afraid to have their opinions challenged. How ironic for people who are supposed to defend free speech. They can't accept the fact that there is also a diversity of opinions within the Democratic Party.
444,be2j3a,"Did they ban you when you posted it the first time, or when you reposted it an hour later?

They've also got a rule about not posting negative things about the Democratic Party. 

As an aside, there's also 17 campaigns that are about stopping Bernie Sanders. It's called a primary and it's not a surprise."
445,be2j3a,"I thought something had gone wrong the first time because it wasn't showing up under ""new"" which is when i reposted it. I used the exact same URL and didn't realize that /r/democrats didn't have an automated filter for double postings like most subs.    

I was temp banned and so I replied to the ban and asked what the reason for the ban was. That was when I was permanently banned.    

I totally get an /r/hillary or /r/dnc taking this kind of aggressive moderating stance but /r/democrats should be a place for all democrats, not just the ones David Brock likes. Might explain why they have 90k users compared to /r/SandersForPresident with 244k.       
Rule 4, technically, says nothing divisive. I have noticed that the legions of posters who regularly trash Bernie Sanders or post articles trashing Bernie Sanders don't receive any of the aggressive moderation that is present on that sub."
446,1epllm,"I am an Anarchist/Conservative/Libertarian. But I admit, I would vote for this ticket in a heartbeat :)"
447,iuastg,THERE WOULD BE MILLIONS DEAD WITHOUT DONALD TRUMP AS PRESIDENT! First to BAN CHINA! FIRST TO STUDY VACCINE! MORE TESTS SINCE ABRAHAM LINCOLN!!! MAGA!!!
448,iuastg,"I find the celebration of covid deaths by some on the left...trashy.

Is the left so desperate and nasty, that they would lie like this just to make a shocking statement?"
449,iuastg,The funniest part is that I can't tell if this is a joke or not anymore.
450,iuastg,4% of the world's population ...20% of the world's death.  you are an idiot.
451,iuastg,It is making a point that Donald has no reason being the President. He has fucked up big time.
452,iuastg,It's not funny...it is terribly sad.  And Donald is to blame.
453,iuastg,FAKE NUMBERS!
454,iuastg,"Lol dude look into those numbers, they’re counting anything and everything as a covid death, and how are you going to blame trump when democrats have been fighting from day one ? For example when he banned travel from China he gets called a Xenophobe, you can’t demand action then be mad about said action it’s one or the other"
455,iuastg,"Ya I know that's the ""Tweenkie"" thing to say these days, but can you bank it up with something more than condescending accusations?"
456,iuastg,"Lol more like democrats fucked up big time, history will show how the democrats have acted for the past 4 years, salty sore losers who will do anything to smear the person they lost to, who was it again that called banning travel from China xenophobic ? Oh that’s right democrats, who were the ones completely ignoring social distancing, grouping up by the thousands and rioting ? Oh that’s right democrats. Gtfoh"
457,iuastg,Ask Donald about fake numbers hahahaha
458,iuastg,"No, no he can’t."
459,hbqnpl,"Which one from the right yells Floyd's death was justified? The right themselves admit there are horrible cops. But a few horrible cops aren't a valid reason to hate every cop, even those who actually save lives."
460,hbqnpl,"Hmmmm, well, Atlanta Police policies state Officer Rolfe violated procedures when Rayshod ran away by firing his weapon.  


So I got your litmus test dangling below my dick (Deez Nutz)"
461,hbqnpl,"Furthermore, this adds to the ""every black person is a thief"". Wrong. Just because a few black dudes wanna steal and shoot with a glock, doesn't mean every black dude is such a criminal. The left shouts this about blacks. Why do they ignore it for cops?"
462,hbqnpl,[deleted]
463,hbqnpl,False
464,hbqnpl,Double False.
465,hbqnpl,"Spot on Bud.

The extreme left/fascist movement thinks if they scream lies long enough, those lies will magically become truth. They will not!

A minority of very loud, very annoying fascists have USED the George Floyd murder and BLM (which is a disgustingly fascist and blatantly racist organization to start with), to execute their anti-American horse kaka. Today these LOSERS are treading on very thin ice.

And ICE is about to crack and deliver a healthy swath of these fascists to the cold water of deportation. As for the rest...I believe its against all sorts of laws, what they've been up to of late. Arrest and cage them."
466,hbqnpl,"This is a huge over generalization about ""the left"" in r/Democrat. This sub has become a breeding ground for people to come trash Democrats with misrepresentations of ideals. Just like y'alls examples, just because some of the left take the movement too far doesn't mean the left in general ignore it for cops. 

It grinds my gears because people say ""oh I don't make this logical fallacy, they do"" and the fact is you can support both police officers and the BLM movement because you support the good cops and the fight for justice and equality without the destruction and violence."
467,hbqnpl,"So are you saying that other black people who don't directly participate in a crime but only allow it to happen, associate with known criminals and fail to report crimes aren't punished?

Because they are.  Its called being an accessory to a crime.

https://en.wikipedia.org/wiki/Accessory_(legal_term)

The issue here is that cops that know about the ""bad apples"" don't intervene.  When they actually have a duty to, while civilians don't *always* carry that duty legally. 

https://www.cnn.com/2017/07/21/us/crime-bystanders-no-charges/index.html

A cop's actual job is to uphold the law.  It is what they are trained to do and what they are paid for.  

A reasonable comparison would be a doctor. Doctors are meant to heal/attempt to heal their patients.  That is what they are trained to do, it is what they are paid to do. 

So if a doctor knowingly allowed a fellow doctor to actively hurt their patients, kill them, or deceive them into paying for unnecessary procedures they would also be held legally accountable. 

This is the crux of the problem.  Cops aren't weeding out their ""bad apples"" they are actively defending and covering for them. (In many, many, many cases.  There are always outliers. Some are taking the necessary step to root out bad apples.  It just needs to be *everyone*.)

I think that is a simple point we can all agree on."
468,hbqnpl,"Yeah. Shit happens. No one can stop 100% bad things from happening. Btw, if no bad things happened, there would be no growth and life would be dull. Also, people forget Tony Timpa died the same exact way back in 2016. Hmm hmm hmm..."
469,hbqnpl,"This sounds like what Hitler and Musolini used to do. Yeah, fuck em."
470,hbqnpl,"Your gears are being grinded for no reason. Your whole argument doesnt sit with what I experienced. I couldnt do both. I was shamed for it. Either one, or the other. I dont care what this sub has turned into.. I care that this country has turned into a huge VS battle. Division everywhere. You are worrying about the wrong thing."
471,hbqnpl,"Firstly, I didnt say a damn thing of what you said, dont put words in my mouth.

Secondly, blacks weed out their bad apples? Come on. Nobody weeds out their family members or close friends. Cops are, by a fair amount but not so many, comprised of family members, you have lots of cops who became cops because their dad or uncle or aunt or whatever were cops or are cops or hold a high rank in the institution. It is why there are investigations from other sources. This is how you weed out bad bad apples. That accessory punishment might exist, but it has its flaws. You cant just expect everyone to be a law abiding citizen, hence you need law enforcment, but that too has its flaws, everything has a flaw in it. Just because of that flaw you cannot cancel the whole damn thing, only fight where the flaw is, not the entirety of it. This is exactly what Im saying. Nothing less, nothing more."
472,hbqnpl,"Bahaha gaslight much? There is definitely reason to be dissatisfied with people who can't make logical arguments and contribute to conversations. I can be annoyed and frustrated by people relying on logical fallacies and trying to force only supporting one of two not mutually exclusive things. It doesn't mean I'm consumed by it or it's the only thing that concerns me. 

Division is stoked by literally everyone. Everyone wants to blame others and not take personal accountability. To me this sub is a place to converse with people about news, policies, etc. without having toxic people relying on logical fallacies to convey ideas. And now it's basically people like you saying to other ""Democrats"" you're concerned for no reason and worried about the wrong thing. So no wonder the country is in disarray, we can't even have a civil discussion in r/Democrat."
473,hbqnpl,"Your comment tried to compare the fact that the left doesn't stereotype all black people based on those who commit crimes, while simultaneously condemning all cops for the crimes of some.  That was your point correct?  Am I misunderstanding and putting words in your mouth?

I never claimed that black people ""weed out"" rotten apples.  I said that they are legally required to in some circumstances. While the same is not required of cops.

My comment illustrated that your comparison is really apples to oranges.  

Not expecting every civilian to report and shun crime is not equivalent to expecting those whose job it specifically is to do so.

It's not a hypocritical stance.  A patient of a doctor (they would be the civilians in this example) are not bound to the same duty a doctor (the trained and paid professional: cops) would have to report it.

I agree there are flaws.  That wasn't the point I was trying to make."
474,hbqnpl,👌 okay bud!
475,hbqnpl,"> apples to oranges

But you can still compare them."
476,hbqnpl,">I agree there are flaws. That wasn't the point I was trying to make.

But I was. This whole time. You are opening another argument. And in regards to your argument, not required for cops? If there are suspects or witnesses they will be called for investigation, or to confess before judges wether they be a president, a cop, a lawyer or even another judge. Where is it written that cops are untouchable by the law or cannot be called to confess?"
477,hbqnpl,"...you can't though.  That's literally what ""apples to oranges"" means.

I think we will have to agree to disagree.

Edit: oh damn you're a bot.  Or having a huge glitch."
478,hbqnpl,"Holy shit dude we just keep talking past each other.

I *understand* your point was to try and give an example of a flaw.

However my *reply* clearly explained that your example of a ""flaw"" was incorrect.  

Your point was trying to state that its hypocritical to stereotype cops (""they are all bad apples"") but NOT stereotype all black people as being criminals when *some* black criminals exist in their community. 

That is literally what you wrote.  If that was not your intention then you need to revise your comment because that's what its interpreted as.

And MY comment was clearly illustrating why your statement is not accurate. 

My comment also DID NOT state that because your example wasn't valid that there are then NO FLAWS.  My comment only addressed your specific example.

I also did not say that cops are untouchable by the law.  Now who is putting words in who's mouth?  

But obviously, if you have watched any news from the past few months then you know that there is an issue with cops evading the law.  If you don't agree with that, then no further conversation can be had.  Because that would be denying the literal reality of the situation. 

I am sorry if I confused you.  But I've spent way too much time trying to explain our exchange and feel like it's useless for me to try.  You seem to want to create a fight.

I'll step aside.  Enjoy your weekend.

Edit: so I see now you are a kid.  So the confusion is somewhat understandable, this problem is much more nuanced than black and white and only experience will teach you that. 

It's awesome though that you are getting involved and learning.  Keep going man and just practice kindness.  Good luck!"
479,hbqnpl,"> apples to oranges

But you can still compare them."
480,hbqnpl,"Trying, its hard our there.. anyway, not like we are gonna solve anything here. Cheers bud!"
481,fhgf4r,High-quality post here.  Nice job.
482,fhgf4r,"Oh look, a twelve year old with political views."
483,fhgf4r,LOL...
484,fhgf4r,"\*plays UNO reverse card\*

BTW nobody delete this post. I want him to be downvoted to hell."
485,fhgf4r,"Well, I didn't like his tax policies giving tax cuts to the wealthy and making the small tax cuts that the rest of us get temporary. I didn't like him taking babies away from their families and then losing their paperwork so that they will never be reunited. I didn't like him pandering to racists, homophobes, and religious bigots. I didn't like the way that he talks about women. I didn't like a hundred other things that he has done. But after hearing your well-reasoned and eloquent argument, I have changed my mind.

/s"
486,fhgf4r,You're just pissed that they're making you wash your hands.
487,fhgf4r,"Aw, is someone not winning today?"
488,fhgf4r,"Just bring up Tara Reade.

I mean if Tara Reade is lying, then Anita Hill and Christine Blasey Ford are liars as well."
489,fhgf4r,Wah wah wah cry me a river you fucking pussies
490,fcj34a,Nah dawg.
491,fcj34a,Agree 100%
492,fcj34a,Yes.
