,post_id,comment
493,f7cfg7,I think conservatives don't like/are insulted by the idea that (1) Trump needs outside help to win and (2) that these less-than-desirable foreign powers want *him* to win.
494,f7cfg7,"They’re also helping Sanders.  And Bernie’s comments on Cuba and Castro, and his staff’s comments on gulags and land confiscation and murdering capitalists, it’s terrifying to Hispanics and Cuban immigrants in Florida, as well as us Midwest moderate democrats. 

Bernie is absolutely frightening. 

I voted for him in ‘16 and I feel stupid that I didn’t see this side of him.  He cannot be allowed to be nominated, Russians backing him or not."
495,f7cfg7,Right on that
496,f7cfg7,"Why would you think conservatives are insulted by that? 

Let's really be blunt about the type of ""interference"" these Russians managed to produce. Essentially they managed to hack Podesta's email account at the DNC, because the dumb twit GAVE them his bloody password. They also posted trash on Twitter and Facebook. That's about the size of it.

People will pick a favorite horse. Why should any conservative care that Putin prefers Trump?"
497,f7cfg7,The outside help he received was Hillary’s campaign and the media.
498,f7cfg7,"Its an interesting how far left Bernie now feels he can safely go. Its very concerning to see all the real fanatical support his position has.

The Russians are not ""coming"". They're here. Have been for a long time now. On the flip-side, American political interests are already ""in"" Russia too. And China, and India, and...

This whole argument has been a joke to begin with. Its the Democrats using a ""boogyman"" to scare Americans into questioning their own POTUS. And because we now know that it was the Democrats who actually USED Russian misinformation and in a sense...""colluded"" with Russians, the fullcourt press to misdirect focus to Trump...MUST continue. And it will, unless Barr has the balls to air all this and make the indictments."
499,f7cfg7,"So generally the resistance to that idea from that side is more about how ""Russia would love to have Hillary in there"" or some nonsense.

Alot of conservative ""fandoms"" are about pride: being stronger, smarter, something-er than the other side. Very emotional."
500,f7cfg7,"LOL...no...I really doubt Russia would want Hillary-Billary back. Not because she can't be bought...she obviously can. But simply because...the woman's an insufferable bitch.

""fandoms""??? Why must Democrats do that? Are you trying to pick a Hillary-Billary-style ""bitch-fight""? 

Staunch conservatives...of which I am not one...tend to believe they represent rational thinking. That's not always the case, of course. But for the last few years, they have made more rational sense than have liberals. They do value strength...and do have their own whacky extremists to deal with. Just like the liberals. I think one difference ""might"" be...is that a conservative will tend to find strength in financial well being, a large national military, and for many...their Gawd. Liberals tend to find strength in what? Numbers maybe? I don't know anymore, and I used to lean left politically.

But man...I just don't recognize them anymore..."
501,f7cfg7,"Trump is strengthening our military standing with Ukraine providing weapons and trying to get nato members to pay more

 Bernie Sanders  wants to cut military spending by half doesn't care if nato members aren't spending  on the military I'm not sure about his policies on aid to Ukraine but I can assume he won't be a big fan of it considering his hate for military spending and being involved in conflicts 

It's funny how Democrats themselves always talk about this mass cover up conspiracy when they themselves have suspicious ties to Ukraine and meddling in our elections they accuse Republicans of trying to influence the Georgia governor's race and various house races when they themselves have been accuses of such things  like the governor's race in Kentucky and the interference of the 2016 election by literally reaching out to foreign governments to obtain documents on Trump  and also having spies in the Trump campaign

Also at this point it means practically nothing when a democrat says it's the Russians literally any Trump supporter online is immediately called a Russian troll or any news story or  study that is pro republican is immediately a Russian troll u can't take it seriously"
502,f7cfg7,"Liberals generally do not identify with the ""winning means you're superior"" mentality: ""Win at any cost"" is not one of their values. They run on numbers and data and such."
503,f7cfg7,"Uhhhmmm…

""Basket of deplorables"". 

Liberals ""assume"" a position of ""moral superiority"", and the quote above lays waste to your idea that ""Win at any cost"" is not a liberal value. We could also include the DNC's rather thorough frigging of Sanders, in the 2015 DNC campaign. They're-a-gonna do it again to Bernie too...just watch...they've already started.

So ""no""...liberals are certainly not terribly concerned with ""numbers and data and such"". They may have at one point, but that point is gone. They appear to have placed their faith in endless accusations and ganging up on opposition, through drowning them out...""outing"" them...or simply beating the shit out of opposition in the streets. Sort-o' like the infamous Brown Shirts.

In short...today's staunch Liberal...has serious anger issues...accompanied by deep feelings of inferiority and desperation, hidden by volume, numbers and a mask of moral superiority.

And THAT is exactly WHY I slid to the right. Well...that and the fact that I finally realized what Globalism really had been doing to North America."
504,f7cfg7,"You are well versed on republican talking points, I see"
505,f7cfg7,"They happen to be good points. Rational.

But I'm doing this because:

A. I'm really curious why the Democrats would continue to beat a dead horse?

B. I happen to miss real Liberalism."
506,ewe8ug,It'll blow over.
507,ewe8ug,When I was a young voter I thought that too.  That was 25 years ago and the UN said our coastlines would be 100 miles inland by now.  I believed them.
508,ewe8ug,Maybe we listen to the scientists when they talk science.
509,ewe8ug,"Because most people just spout the same nonsense they read online or hear the mainstream news agencies spout. That whole ""97% of scientists agree"" bs  is a sham and a lie."
510,ewe8ug,I see what you did there.
511,etjdml,"Bernie’s high level staff are on unedited video saying they want to discuss seizing all land and murdering capitalists on the beach (which includes most democrats by the way). 

He has said nothing. I think He’s possibly the most existential threat to mankind since Mao.  He would split this country into a civil war so fast you’d beg to have trump back."
512,cwm470,Who cares?
513,9m96a5,No dickhead Fuck You! I love Stone Cold Steve Austin. Don't compare one of my heros to a fucking rapist.
514,9m96a5,"I LIKE BEER, SENATOR, DO YOU? YOU FUCKING PUSSY BITCH"
515,9m96a5,You’re a rapist....now you are officially a rapist
516,9m96a5,"Oh right of course theres literally nobody less of a fucking pussy than Drumpf, the man is a fucking draft Dodger, he got over 400million dollars from his daddy and still went bankrupt multiple times, he could never get laid if wasn't rich...oh yeah ok I'll take beer."
517,9m96a5,"Dodging the draft was the best thing you could do.

Imagine fighting in a gay ass war like Vietnam

I mean this unironically"
518,9m96a5,"Damn right screw the military. Nobody should've served in Iraq. Bunch of of idiots.
(I mean this sarcastically, with all due respect to the military and and all the brave young men and women serving across the world...also to the servicemen of the American allies (which Trump now hates for some reason) who shed their blood alongside the US."
519,9m96a5," —Eugene McCarthy, 1969"
520,9m96a5,Keyboard warrior over here. Watch out for this guy. Your parents were likely the pieces of shit that shunned our troops returning home. And now the shitspawns of those hippie morons directly contradict themselves every time they open their mouths
521,5wapj7,"Say what you will about republicans but they stick together and compromise for the greater progress of their party. The dnc is far from perfect, but those who sat out this election gave us president trump. We need to stick together and vote for the greater good. Yes forward progress won't be as fast as we want it (i.e. If we had bernie), but now we are fighting to keep rights that were already earned: there will be no forward progress until democrats realize that they need to vote together "
522,5wapj7,"Oh I agree. I'm getting involved in the dem party at a local level! Additionally, reading ""don't think of an elephant"" to help my own (and the party's) framing in the future. But we also need to remember who we are hurting if we sit it out... hint: it's us and those who we support."
523,5wapj7,We should be showing up in force to Democratic town halls demanding that they uphold the values that our party apparently stands for. They must be held accountable too.
524,44oddk,"> Survey after poll after focus group shows that substantial majorities of Republicans support much of the Sanders economic plan. 

Supporting ""much"" of a plan doesn't matter if they consider the rest to be a dealbreaker.

> One issue is the disconnect between what politicians promise and what they could deliver. Sanders would need to win in a sweep election that gave Democrats strong majorities in Congress to get his policies enacted into law.

That's not one issue, that's THE issue. This also assumes that his policies would be universally supported by Democrats, which is a poor assumption.  

> And when hard times come, he wants government to first take care of the little people, not the political donor class, as both Presidents George W. Bush and Barack Obama have done. Sanders also wants universal health care, paid for with tax money.

Obama *wanted* to support the little people too. Hillary *wanted* universal healthcare in the early 90's. Recognizing what is an is not practical in our real political climate is not the same as wanting things. 

> His plans, if smartly put into law

When is the last time this happened?

> More than 80% of Americans support raising taxes if necessary to permanently maintain Social Security, with strong majority support among Republicans, according to surveys by the National Academy of Social Insurance, Social Security Works and others.

Because ""raising"" taxes is a vague metric. It says nothing about how much. 

> This is essentially Sanders' stance. What's so radical about that?

It's the ""how much"" and just ""how"". 

> Sanders also wants to invest in the future of America by making public universities free again. The money would come from a tax on Wall Street speculators who buy and resell stocks in less than a second.

Another idea that is great in theory. 

> The Sanders campaign notes that ""last year, Germany eliminated tuition because they believed that charging students $1,300 per year was discouraging Germans from going to college"" and that the Nordic countries and many others provide college free because it spurs economic growth.

The scale and diversity of our economy is in a different league. 

> Meantime, Sanders would restore the ability of workers to form unions and bargain jointly. 

Really? He would personally do that? Are we electing a dictator or a president?

> And those are the policies of the Sanders campaign.

The key word here is *campaign*. Obama's campaign was all about change as well. You don't have to be a political expert to see the real challenge of the office is not coming up with ideas, but actually turning those ideas into reality. He has been a member of the very Congress that has disappointed all of us, so he knows as well as anyone that most of these things will never happen. I don't see how his unrealistic promises could be considered anything but misleading. 
"
525,44oddk,[deleted]
526,44oddk,https://www.isidewith.com/ is the first thing I thought of reading this title
527,44oddk,"You feel the BERN , don't ya! LoL  Bernie or Green Party all the way ......"
528,44oddk,"I will only vote for Bernie, I am not looking at the either party but to the individual who will best represent what I truly want.  I would never vote for Hillary , I fear that she is in the [deep pockets](https://i.imgur.com/n6VT2kA.jpg) of [Goldman Sachs](http://www.realclearpolitics.com/video/2016/02/04/hillary_clinton_i_took_675000_in_speaking_fees_from_wall_street_because_i_didnt_know_i_would_run_for_president.html). She is untrustworthy , want [Single-Payer Healthcare?](http://www.ibtimes.com/political-capital/hillary-clinton-gets-13-million-health-industry-now-says-single-payer-will-never)
No, better than that  , think she is not being influenced by [George Soros](www.usatoday.com/story/news/politics/onpolitics/2016/01/31/george-soros-pumps-6-million-into-pac-supporting-hillary-clinton/79618384/)?  think again.  She is a [total sell out](http://www.thegazette.com/subject/news/government/fact-check/factchecker-hillary-clintons-wall-streetiowa-contributions-20160129) .  I am voting Green Party if Bernie does not get the nomination."
529,44oddk,"I see no evidence that Clinton will stand up to the powers-that-be beyond telling them to ""cut it out."" Her record is one of bad decisions. Sanders' record shows good judgment and, more importantly, it shows that he is on my side rather than the side of big business. I don't care what Clinton says--and, yes, she says all the right things and sounds ""presidential"" overall--because she can't hide from her record. "
530,44oddk,Watch her speak on [the issues](https://www.youtube.com/watch?v=-dY77j6uBHI )
531,44oddk,"I would never vote Hillary.  I was rooting for Rand Paul, but now that he is out, Bernie is the only meaningful alternative.  While his legislative policies are socialist, his executive policies are libertarian.  For president, he would have my vote."
532,44oddk,"Sanders record show only that: good judgement, that is to say judging and criticizing the leadership of others. There is a huge difference between saying that you think someone made a wrong decision and being the one to make the decisions. We have no record of what would have happened if things always went his way so there is no way to actually compare what actually happened with what would have happened. Hillary can't hide from a record because she has a record on a national stage. Bernie has no record other than representing a small, extremely liberal state. It would be like a departmental manager claiming that he can run a company better than the CEO. *Maybe* he could, but it's not enough to just criticize the CEO, you actually have to demonstrate how you would realistically do better. Bernie has not shown how he would actually make any of his plans happen, not to mention how he plans to even make it into office without moderate support. "
533,44oddk,"> I was rooting for Rand Paul, but now that he is out, Bernie is the only meaningful alternative.

This makes zero sense. They're on complete opposite ends of the spectrum. They have almost zero policy overlap; they agree on almost nothing. All you care about is that they're not ""establishment"" and will let you smoke pot, let's be honest."
534,44oddk,"You have a point, and I admit that I've been pretty disappointed in his response to this kind of questioning--deflection. When asked how he would put his ideas into effect, he simply doesn't answer.  
  
That said, I don't doubt his integrity, and for me, that's one of the most important factors in voting for anyone: are they on my side or not. I doubt Clinton's integrity. She changes her positions based on political expediency (I honestly have no idea what she believes in), is favored by wealthy donors, and has shown that she is in favor of war when it is not necessary. "
535,44oddk,"Also, auditing the Fed, prison reform, the surveillance state, and foreign policy.  I don't smoke pot, but yeah, that should be legal.

There is no political spectrum.  That's a lie to promote ""moderate"" politics."
536,44oddk,"> I doubt Clinton's integrity. She changes her positions based on political expediency

I don't doubt her integrity. She is a politician and she owns that. She won't try to gloss over the reality of politics even when she knows that it will mean more shit-slinging from the Republicans and Bernie's campaign. I have less trust in someone pretending to be *above it all*. To think that anyone makes it to that level without playing the game is just naive. Bernie is playing a game just as much as she is, except that his strategy is to make unrealistic promises because it's working and let Hillary face the lion's share of scrutiny. How is deflecting questions about how he would deliver on his promises not an issue of integrity? If it stops working, he'll change tactics, guaranteed.

>  She changes her positions based on political expediency (I honestly have no idea what she believes in), is favored by wealthy donors, and has shown that she is in favor of war when it is not necessary.

If you follow the history of her career, her changes make sense in the context of decades of political history and learning from her experiences. There's a huge difference between fighting for a cause, getting knocked down, dusting yourself off and changing your strategy than just arbitrarily changing your mind. 

Regarding wealthy donors: this is a convenient way for Bernie to capitalize on the fact that he's not getting large donations without actually having to convince people that he's a better investment. Again, it's a reality of politics. His grassroots funding isn't going to help the people he's supposedly stands for if it just sets us up to lose to the Republicans. I'm all for campaign finance reform - it would be great if someone who is an experienced member of Congress would lead those policy changes, I wonder who might be a good person to do that. Until that happens, I'd rather not have the Democrats set ourselves up to be at a disadvantage. 

Regarding the war, she has admitted that she was wrong. Keep in mind that the Bush administration *lied* about the justifications for starting that war and she was representing the state that was attacked. Bernie simply was not in the same political position at the time. If someone makes a mistake, I want them to fess up and tell me what they would do differently the next time. What does Bernie have to say about what he's learned from being a part of an ineffective Congress who he would have to rely on to make his promises a reality?"
537,ivhmrg,You hate to see it...
538,ivhmrg,RIP Madam.
539,i9ft4c,"Careful with that Moscow Mitch, or someone can say Moscow McGrath. After all if people can attack Tulsi for being some kind of Russian agent by someone in the Democratic party, any Democrat can be attacked."
540,i9ft4c,"I don't understand this ""Moscow Mitch"" thing."
541,i9ft4c,Isn’t she an openly pro Trump Democrat? I thought I heard that somewhere
542,i9ft4c,Still better than Moscow Mitch
543,i87iz5,"This is exactly the stuff of which we're going to hear more and more from his camp. Unironically, at that."
544,i87iz5,[removed]
545,i87iz5,[removed]
546,hs9kzi,OMG...The Dems are up the creak without a Duckworth...
547,hs9kzi,A.K.A The list of women Pedo Biden wants to rape. Trump 2020!
548,g5uasw,Is it morning in Russia already?
549,g5uasw,Let's start showing the pictures or videos of Trump walking through the miss teen changing rooms. And then commenting how he can do what ever he wants to. Or his videos with stormy Daniels.
550,g5uasw,[removed]
551,g5uasw,That's what we do and what we are. Nagging  Hypocrites.  Do as we say not as we do.
552,g5uasw,"Something like that ...

Reade's allegations are troubling, but this should be dealt with in a court of law, not in the court of public opinion."
553,g5uasw,Another one of those crazy Russian trolls right ?
554,g5uasw,"ROFLMAO!!!

Joe's DOA and everyone already knows it."
555,g5gmwc,"Honestly, I’m a libertarian that leans to the right on many but not all things. 
If you want to change my mind, why would they prop up this man who by even a casual glance seems to need help? 
There is no way that it is conceivable that he can go toe-to-toe with Trump in a debate. 
Campaigning is very tough, kinda like going on tour, much like Hillary, I don’t think he can take it."
556,g5gmwc,"Shut the fuck up, clown."
557,g5gmwc,Bernie bot Russian alert...fck off idiot...and shut up
558,g5gmwc,[deleted]
559,g5gmwc,"Yang Gang....... Yang was such a strong moderate/central candidate, Biden never had anywhere close to that kind of substance........ but yet literally every other candidate ended up backing him at just the right time to pick up more and more momentum. The old people voted for him for the sentimental value I suppose. Forcing mediocre polarizing candidates on us is how we get 4 years of Trump I wish DNC would have learned their lesson but they clearly have learned nothing. Bernie had the right assessment of the problem, Yang had the best solution. Biden has the name brand but that matchup against Trump is going to be terrible."
560,g5gmwc,Simp
561,g5gmwc,"beep boop im a russian bot, never mentioned bernie though, not a huge fan of him"
562,g5gmwc,you might be delusional
563,g5gmwc,"why? he will be older than reagan was on the day he left office if he gets elected. he gets things confused when he speaks. “We hold these truths to be self-evident. All men and women are created, by the, you know, you know the thing.”

&#x200B;

it is a fair point."
564,g5gmwc,"Because of butthurt n
Bernie bots...listen to your god and do the right thng"
565,g5gmwc,we will have another 4 years of chump
566,g5gmwc,"Not as delusional as yer mom
***
^I ^am ^a ^bot. ^Downvote ^to ^remove. ^[PM](https://www.reddit.com/message/compose/?to=YoMommaJokeBot) ^me ^if ^there's ^anything ^for ^me ^to ^know!"
567,g5gmwc,[deleted]
568,g5gmwc,"Yes you will...and why?

Because you let the whims of a gawd-damn walking Maybaline ad, determine your platform.

I only hope real Democrats learn from this childish experience."
569,g5gmwc,"you're good fodder for the ""tolerant left"" sarcastic posts people make."
570,g5gmwc,"i accuse you of having a garden rake up your ass, you obstinate fuckhead"
571,g5gmwc,[deleted]
572,g5gmwc,I love that you made my point for me.
573,g0szvq,"The only thing I would say to this is don’t let the perfect become the enemy of the good. Trump is a known evil, if you will. I’m a woman and honestly I hate Biden, but he is unfortunately better than Trump. I’m not going to be jumping for joy in casting my vote for him, but just saying “I hate both of these people so I’m not voting” is pretty reckless"
574,g0szvq,"Interesting. Declining Democrat votes.

Gonna shoot the other foot too?"
575,g0szvq,"I am in TOTAL agreement with you. Democrats have screwed themselves. 

More explicitly, the elite and geriatric ""OK Boomer"" Democrats have screwed themselves and everyone else with a conservative agenda that does little to nothing for the rest of us.

These geriatric Democrats, who run the show, give the rest of us nothing positive to vote for.

Their whole agenda is based on:  Trump is bad, throw him out, don't ask for more."
576,g0szvq,Second times a charm
577,g0szvq,"If you want to make your vote matter, vote Green.

Getting them to 5% will get them federal funding.  15% and they will get a seat at the table during those Presidential debates.

Neither the Republicans nor Democrats want that."
578,g0szvq,I personally think trump is a great president
579,g0szvq,"I'm discusted with Biden and Sanders. The  wall street puppet and the commie bomb thrower. With luck (and half a mind), Biden will choose Warren as running mate and beat Trump then have a stroke and we'll have president Warren. 

If Biden chooses anyone else I'll be about done with the Democratic party."
580,g0szvq,Not voting IS voting for tRump!!!
581,g0szvq,Another dumbass has squeaked...fuck off loser...
582,g0szvq,Agreed. Not all of us have the luxury of being able to wait another four years.
583,g0szvq,">The only thing I would say to this is don’t let the perfect become the enemy of the good.

Yeah! That's right! Always vote for the lesser evil and make sure no change ever happens ever!"
584,g0szvq,"You don't have to cast a vote period if you don't agree with any of the candidates. I dont know about you, but my ethic and moral code I hold myself up to will not allow me to give someone I deeply disagree with my vote. My vote is my word."
585,g0szvq,"I'm declining to vote for anyone whom I do not believe in. I've never voted based on party. Neither Biden or Trump encompass my ideals, so why vote for either?"
586,g0szvq,"Which in theory, will prevent progressives from changing anything for sixteen years.

Not bad, neoliberals. It'll be the conservative agenda for almost 20 years. Well long enough to make everyone forget about this Bernie guy."
587,g0szvq,"He’s very likely NOT going to choose warren just FYI. In the last debate between him and sanders- he said he had a woman of color pick basically (when asked by the moderator if they would look for a woman of color, Biden said his veep would be one). I personally hope it’s someone with a progressive platform to round in some of the Bernie camp and hopefully warren camp as well!"
588,g0szvq,Ah yes Warren. The lifelong Republican who suddenly decided she was a Democrat.
