,post_id,comment
0,5oy15r,[deleted]
1,5oy15r,"This is official picture? 

So this is being brigaded by the_d right? Cause this sub isn't even active...  lmao"
2,5oy15r,What a horrible combover. 
3,5oy15r,He looks like such a dumbfuck when he's trying to look serious.
4,5oy15r,Lotta Vodka drinkers in here.
5,5oy15r,[46th president](https://res.cloudinary.com/crowdpac/image/upload/d_avatar_m/v1/candidates/cand10361902.jpg)
6,5oy15r,[deleted]
7,5oy15r,"What a weird day.  This was posted in r/republican (with all negative comments for some reason), but it's upvoted in r/democrat.

Fucking shills be shillin?  Is anyone on Reddit real anymore?"
8,5oy15r,"28 reports. lol

16: Spam
3: <no reason>
1: picture of an orange, baby handed faggot
1: Breaking reddit
1: Brigaded
1: how long is it going to take you idiots to start claiming you never liked the guy? a week? a month?
1: Vote brigade
1: troll from the_donald
1: Brigading
1: not a democrat
1: brigaded by thedonald
"
9,5oy15r,There is no mod.
10,5oy15r,SAD!
11,5oy15r,God Bless the United States of America!
12,5oy15r,"Beautiful man!  

Edit: down voted for being a positive and happy individual. Sad! "
13,5oy15r,WHAT A BEAUTIFUL MAN. PRAISE DON
14,5oy15r,#THE_DONALD TAKEOVER!
15,5oy15r,It's also the kind of thing we post over on /r/notinteresting. 
16,5oy15r,"But hey, they definitely don't brigade. And they're DEFINITELY victims, all the time."
17,5oy15r,Man are they going to be angry in 4 years when they have no one to blame. 
18,5oy15r,Yes
19,5oy15r,">So this is being brigaded by the_d right? Cause this sub isn't even active... lmao


I was floored for a second.
"
20,5oy15r,Just look at ops last comment lol. 
21,5oy15r,It surprises me that Donald would approve of a photo with such an obvious comb-over. 
22,5oy15r,"[No, this is the official one](http://theoutsidescoop.net/wp-content/uploads/2011/10/poo.png)"
23,5oy15r,Of course the r/Democrat sub isn't active. Low energy. LMAO 
24,5oy15r,This official. Officially posted. 
25,5oy15r,How long do you think? Over/under 100 days?
26,5oy15r,"Yup, looks like him to me.  What are we missing?"
27,5oy15r,"No you're not, you regularly post on /r/The_Dunce "
28,5oy15r,Me too. *siiiiiiiiiiiigh*
29,5oy15r,It's a sad day when this gets downvoted. 
30,5oy15r,"We treat politicians like politicians not like sex symbols.  It's ok with us that you find him attractive, everyone has their type, but it's not really the place to swoon over him.  "
31,5oy15r,"Obviously a Russian. ""Fedor"""
32,5oy15r,[deleted]
33,5oy15r,I got downvoted in /r/The_Donald for saying the takeover was funny. 
34,5oy15r,I just checked their subreddit and they're spamming the same picture  as much as they can. (and then they will complain about reddit admins despite breaking nearly every spam/brigading rule in the book)
35,5oy15r,[deleted]
36,5oy15r,I'm looking forward to some apologist logic acrobatics.  Should be entertaining.
37,5oy15r,"Sad in 8 years, more likely. But hey, then we get eight years of Ivanka!"
38,5oy15r,Because it's r/democrats not democrat lol which is pretty much as active as r/republican 
39,5oy15r,"Over 100, there's no way republicans could impeach him in less than that, even if they wanted to on day one.  I could easily see even odds at 18 months though."
40,5oy15r,"I guess with such a wave of embarrassing news about Trump, something finally happened that /r/the_donald could gloat about without feeling ashamed.  That thing they could gloat about was literally that a picture was taken.  It's not even a good picture (obvious combover is obvious) but at least it's not *embarrassingly* bad, so it's the best they've got."
41,5oy15r,"It's because our country is raaaaaasist, homophobic, is..... Eh fuck it, they are just butthurt and whiny because they lose their food stamps and government hand holding "
42,5oy15r,Gotcha. Very Classy
43,5oy15r,It is funny. Reddit today is very... Unbalanced. 
44,5oy15r,"Safe spaces are for them, not for others!  "
45,5oy15r,"On /r/notinteresting, we post things that are not interesting, such as stating that the post is a picture of the 45th U.S. President and it being a picture of the 45th U.S. President. We might also post, ""This is an apple,"" on a picture of an apple. I didn't mean to suggest anything about Trump's presidency in my comment. I just found this post in general to be pretty strange on /r/Democrat."
46,5oy15r,"It's crazy how these shenanigans are tolerated in dem subs. Act like you are now in any conservative sub, and you'll be banned for sure. Maybe you should grow up. Just a thought."
47,5oy15r,"Reddit, remind me in 8 years to watch the next president get elected. "
48,5oy15r,"""News"" "
49,5oy15r,"Oh and take your own advice, you have one of the most childish post logs I've bothered to look at."
50,5oy15r,Very interesting thought.
51,5oy15r,">I know you are, but what am I?  

FTFY"
52,5oy15r,"oooo, two comments! sombuddy's salty!!"
53,5oy15r,"your 2 comments don't count? salty liberals :P
EDIT: Sorry to accuse you of editing your comment, was wrong but hey you're still salty. ^^"
54,5oy15r,"Huh? I haven't edited any comments, dipshit."
55,5oy15r,"Who cares if you haven't, still salty boy."
56,5oy15r,"I know you are, but what am I?"
57,b8hvxj,[deleted]
58,b8hvxj,"Um...I think a better strategy would be to not have a nominee that openly raped 85 women in public. There are a ton of choices, there is no reason to tie ourselves to such a flawed candidate. "
59,b8hvxj,"I wouldnt expect a different comment from someone with a handle ""college_safe_space"""
60,b8hvxj,"""Rape is ok so long as they are on my side"""
61,b8hvxj,">he could openly rape 85 women in public.

I thought rape is bad?"
62,b8hvxj,This is a very stupid comment.
63,b8hvxj,"This is some sick stuff right here. Really drives home the argument that people like you don't actually care about victims or these sorts of allegations unless they're politically convenient for ""your side"". Shame."
64,b8hvxj,"and all this from the very people who say ""trump voters would vote for him no matter what"""
65,b8hvxj,"You first

A test if you will"
66,b8hvxj,Unless you want trump to win 2020.
67,b8hvxj,Only when it's a republican
68,b8hvxj,"I agree, I think if it is Trump v Biden, we get four more years of Trump. Unfortunately, I don't think the DNC learned their lesson from 2016, and they are going to force a Biden ticket with superdelegates, probably with Mayor Pete or Beta as VP, and Trump is going to win."
69,b8hvxj,"so if it was trump v biden but biden raped 85 people and killed a man, you’d still vote for biden? 

That’s a little fucked up, not gonna lie."
70,b8hvxj,I wouldn't be surprised to see a Biden/Beto ticket.
71,b8hvxj,"It doesn't matter what the DNC does at this point.  The people who hated trump in the beginning are still going to vote DNC. Blacks still think Trump is a big time racist, and really nothing is gonna change their minds.    

Look at all the blacks who voted for a racist Democrat Ralph Northam or at least a former racist in Virginia who got caught with a KKK costume under his name in the year book and said ""that's not me""  .    People will vote for a racist because they are sooooo blind.    They have zero clue how corrupt the party they are voting for really is.   

People will vote for corrupt politicians because they somehow feel the other party is more corrupt when in fact, they are both corrupt.    

This is why nothing really gets done in this country because people have no idea how... their country really works.

The clear cut best way to put turmoil to corruption in both these parties is to vote independent. Keep voting independent until they start to fill up seats one by one.

People have the same piss poor excuse for this. ""They will never win"" 

Well if you believe that, and you don't vote for them...well of course they aren't going to win.  

This is equivalent to saying ""ahh I'm not ever gonna start my own business because I know I will fail"".     Of course you will fail, you didn't even try. 

I used to think the same thing, when I was 19.  However I stuck to my guns and kept voting independent because I said to myself, as long as I stick to it, eventually people will start doing exactly what I'm doing one by one. Even if it takes 100 years (if we survive that long)...it's going to happen.    We have to start somewhere.  

We can't start from the top and work our way up."
72,b8hvxj,">Beta

lulz"
73,b8hvxj,"oh fuck no, ill be voting Trump unless dems decide to put someone against Trump who isn't so far left that it'll turn our country into Venezuela, which so far hasn't been promising."
74,b8hvxj,"dude i'm pretty sure he's just exaggerating. that or he's batshit crazy. that'll obviously never happen, this is pointless."
75,b8hvxj,Are the Dems allowed to put two white guys on the ticket anymore?
76,b8hvxj,">	unless dems decide to put someone against Trump who isn’t so far left that it’ll turn our country into Venezuela

That will not happen this time and probably won’t in 2024 either. Biden is the token candidate like Clinton was last time and the only way he doesn’t win the primary is if he does something so unforgivable that even Obama condemns him. Or he dies, which is unlikely by next year. Even his kiddy sniffing and groping videos aren’t enough to write him off, apparently. The only person I can think of who fits your description is Tulsi Gabbard but you should see the way the left treats her. They talk about her as if she skins people alive for sport, it’s unreal.

Yang is close but his UBI ideas are yet another heavy-handed, government-dependent top down answer to a set of problems way too complex and nuanced that a “free” monthly paycheck could address. In fact, I firmly believe it would cause more problems than it would solve. And besides, once you open that Pandora’s Box, the *only* way to get elected from there on out is to continually promise people more “free” money and continue ignoring the “is this affordable and working” question.

The left is eating itself. Something like 20% of Bernie fans won’t vote for anyone else if he loses the primary, or may even give Trump the spite vote. How many of them are calling for the end of the Electoral College so far? They lost, still can’t cope with it, and now they want to change the rules. These past two years have been the most pathetic display of poor sportsmanship that I’ve seen in my entire life. And don’t even get me started on the influx of identitarian leftists like AOC who are accelerating this disintegration of the Democrat party from within."
77,b8hvxj,"> Venezuela

for the record...venezuela has a ton of problems outside being socialist. how you people can't see that is mind boggling. 

They're sitting on the biggest oil reserve. a lot of fucked up shit is happening there by powerful countries trying to sway the outcome. blaming it on one ideology (an ideology i don't agree with) is fucking stupid."
78,b8hvxj,I think Beto is claiming to be Hispanic now.
79,b8hvxj,I agree with everything here.
80,b8hvxj,"> Something like 20% of Bernie fans won’t vote for anyone else if he loses the primary, or may even give Trump the spite vote. 

This Bernie fan voted for Trump, and not out of spite."
81,b8hvxj,">Beto

Did you mean Robert Francis O'Rourke?"
82,b8hvxj,Transracial. Him and Rachel Dolezal.
83,b8hvxj,I’m a former Bernie guy voting for Trump next year also. I think there are a lot more of us than anyone is willing to admit.
84,fdimqk,yes
85,fdimqk,Yes
86,fe1kei,"I think there are a bunch of disaffected Republicans coming over to our side because of president 4chan. The dems have always been a big tent party, and now we're starting to think, ""Maybe it's *too big* of a tent"" and we start applying purity tests."
87,fe1kei,We need more than 2 viable parties. Period
88,fe1kei,"well yeah, that's why we lost in 2016; you scared off the moderates"
89,fe1kei,"Italy is proof Bernie Sanders is crazy about healthcare, and Joe Budden just punched him in the face and he was too weak to fire back."
90,fe1kei,"LOL...Democrats eating their own. How...stupid.

Sounds like you're a ""Bernie-Boy""? Communism is not coming to the USA any time soon. But please...go out and argue with your own base. Show your anger and desperation loudly and boldly. Tell off all those nasty faux-Democrats who don't want a 95% tax rate. Then...

Enjoy the election... ;)"
91,fe1kei,"Are you serious? Because, if so, this post is totally absurd. The Democratic Party represents different views, and that includes those who don't support ""Medicare for All, Tuition Free Schooling, $15 minimum wage and paid leave for new mothers"" to varying degrees."
92,fe1kei,We are the middle...the left and right have become cults worshippers of men...not the job or what they can accomplish....electing a man who cannot bring people together....pitting the rabid trump humpers against the Bernie worshippers for four years is not the way I want to live...it will be a war of cults....we need the middle to get anything done...it won't be what either sides want but it's chipping away at it....if you don't like that ...work n electing progressive congressman
93,fe1kei,"I disagree, and I frankly think that your view is not only logically ridiculous, it's also self defeating because it is likely to prevent the things that you want to see enacted from ever being enacted.  And, it's offensive and exclusionary.  You're basically saying that people who don't agree with you on everything can't be in your party.

I support Medicare for all, and paid leave for new mothers.  I don't know enough about how Tuition Free School would impact the overall economy, so I don't have a strong position on that except to say that I have 3 children who will be attending college (I hope) in the next 10 years, and I would love for their schooling to be free, as I don't want them to start their adult lives in debt.  I absolutely do not support a $15 minimum wage, and if you were an employer of \~300 people and struggling to make payroll each week (like I am), you wouldn't support it either.  We've had to shorten our operating hours and cut payroll as a result of the $11/hour minimum wage.  $15 would prevent me from being solvent.  I don't think you understand what a $15 minimum wage does to a business who has employees who make from minimum wage up to six figures.  When a $15 minimum wage is enacted, what do you think happens to the people who are currently making $15/hour? Do you think they're happy being among the lowest paid employees?  Of course not, they demand a raise too.  And now that the $15/hour employee is making $18/hour, what do you think the $18/hour employee wants?  The result of increasing the minimum wage is that every single person in the organization will also demand a raise.  We've done the math -- if/when minimum wage goes to $15, greater than every cent of my profit plus my salary will be take up by the extra payroll costs.

But, I'm pro-choice, pro separation of church and state, pro strong social safety network, pro social programs, pro LGBTQIA+ rights, pro equality,  pro net neutrality, pro-environment, and against silly tax cuts that only benefit the rich.  Anything else you'd like to know?

I've already been banned from /r/conservative for pointing our that the current Republicans in Washington don't really support traditionally conservative positions.  If you want to ban me from being a Democrat because I don't support the $15 minimum wage, just let me know, and I promise I won't vote for democrats anymore."
94,fe1kei,"Democrats could win, if they vote. Poor people have barriers to voting. If Democrats are the party of poor progressives, then we will never win."
95,fe1kei,damn right!!!
96,fe1kei,Aren’t this like all of Biden’s policies tho
97,fe1kei,Ummm.. actually you are mistaken.. what you are describing is being a socialist not a democrat.
98,fe1kei,"You dont have to be a Republican to understand $15 minimum wage is stupid. And if you truly believe you can't make it off of minimum wage, you have never been put in that boat. It's also probable that your job history is not working in your favor. There are people who bust their asses day in and day out for $15 an hour, and this type of comment suggests a job with the minimum requirement to work there is you being old enough deserves the same pay out as someone like a CNA, Firefighter, or even truck driver."
99,fe1kei,"Yeah, the conspiracy theorist in me things ""Moderate"" Democrats are just here to further fragment the vote and making sure no progressive ideals ever have enough momentum. ""Moderate"" Democrats like to brag about how Hilary won the popular in vote in 2016 but if you ask ""Moderate"" Democrats about getting rid of delegates they'll look at you like you have two heads. PICK A LANE."
100,fe1kei,Maybe I should not have worn my halloween mask to vote
101,fe1kei,"> Italy is proof Bernie Sanders is crazy about healthcare

Please explain."
102,fe1kei,"1. I don't know what a ""Bernie-Boy"" is but how about you get out of your bubble and try having an actual conversation with people that might hold different views than your own.

2. There will always be people debating within parties their respective parties. Currently the more progressive wing of the Democratic party is trying to push the party towards decisions and candidates that would arguably bring us up to speed with the rest of modern world when it comes to education and healthcare for example. 

3. I agree Communism is not coming to the USA. I do hope Democratic Socialism is something America will still consider given how little our social safety nets have done to help during the current pandemic.

Here is a link to Bernie Sanders website: 

Link: https://berniesanders.com/issues/

There's a Read More option which explain in detail how Bernie plans to pay for everything."
103,fe1kei,What’s the point of being a Democrat? Why not just be a Republican?
104,fe1kei,"""How is it that Dem leaders can muster the strategy , speed, and and determination to oppose a progressive grassroots. movment...but are utterly inept confronting GOP authoritarianism"" - Peter Daou"
105,fe1kei,""" In my Inaugural I laid down the simple proposition that nobody is going to starve in this country. It seems to me to be equally plain that **no business which depends for existence on paying less than living wages to its workers has any right to continue** in this country. By ""business"" I mean the whole of commerce as well as the whole of industry; by workers I mean all workers, the white collar class as well as the men in overalls; and by living wages I mean more than a bare subsistence level-I mean the wages of decent living. ""   - Franklin D. Roosevelt"
106,fe1kei,"Whoa whoa whoa first off I think I totally came off to harshly. It’s totally ok too disagree and I don’t want you to feel like you don’t belong in the party. You have a right to it just as much as everyone else here. I think agreeing on most things is perfectly ok. I just think to be a Democrat you should at least believe in SOME OF THOSE IDEALS and I don’t mean some half ass Medicare for all who want it crap. Secondly, congrats on your families success and I hope all your children graduate debt free.

The people in the party (not the voters but the people in charge) have at best questionable views and progressive ideas. I don’t own a business so I would default to you in terms of what is and is not feasible but there’s a difference between not being able to make pay roll and not being able to afford your 8th house. We as a nation should work to make sure people like you (job creaters) are given all the help they need to continue what you’re doing BUT that doesn’t mean people don’t deserve a living wage which is not $11/hr. I was lucky enough to be in an industry with very high demand and I work very hard to keep myself competitive. I pulled the fuck out of my bootstraps but I can’t help realizing that not everyone is lucky enough to be given opportunities (earned or otherwise). Rising out of poverty is hard.

Lastly, totally didn’t mean to pick a fight with fellow Democrats but if you don’t believe in one of these 

 - Medicare For All
- Holiday for voting for our president 
 - Tuition Free Education 
 - Increasing the minimum wage
 - Paid time off for mothers
 - Man made climate change 
 - Stopping the for profit prison system that are literally allowed to sue a fucking state if they don’t have enough prisoners

Are you even a Democrat? What does a Democrat even mean if you don’t believe in progressive ideals that help the most amount of people. I could go on but it sounds like we agree on a lot of things but if the people at the top of the Democratic Party aren’t willing to take strong stances FOR* these important issues then what the fuck is even a Democrat?"
107,fe1kei,"No they can't.  Look at the comments directed at me in this thread -- it deems like vociferous Democrats are hell bent on not only being the party of poor progressives, but also on being the party that actively excludes progressives who aren't poor.  Very sad."
108,fe1kei,I’m SO UPSET at the apathy from young people. It’s hard for poor people to vote but I do early voting and they just mail me my ballot. I’m not sure why everyone can’t do that? I’m not being sarcastic I actually don’t know. Either way. Why aren’t Democrats pushing for a voting holiday?
109,fe1kei,They are not
110,fe1kei,Nope. :)
111,fe1kei,How so?
112,fe1kei,"But see, they're *actually going to vote Democrat*, so they're not going to ""fragment the vote"" necessarily. They're new democrats: it's like getting out of an abusive relationship.

There are also people like me who are kind of identity voters? Like, I vote Dem no matter who. I voted Bernie, but I don't care."
113,fe1kei,"Huh...its this sort of nonsense that moved me to the right. Progressives want all their demands met right friggin' now, or their gonna scream obscenities at everyone.

So I did PICK A LANE...and I blame reactionary, spoiled little brats for destroying real Liberalism."
114,fe1kei,"Government healthcare single-payer, they have one of the worst healthcare systems in the world"
115,fe1kei,"I have little to no interest in Bernie's website. I've been listening to his haranguing for a long time now. He has adopted 2 major problems now...I mean aside from the lack of posture and hair style...

1. Open borders policy.

2. The Green New Deal.

Between them, a semi-believable idea...becomes a tax burden and devaluation of the Dollar, that nobody wants. Not even you.

Progressivism has hi-jacked the Liberal agenda. A very loud and self-entitled minority, who want their playstation, and want it right gawd-damn now! Do you know how long it took many of these ""rest of the modern world"" countries to implement universal healthcare?

Progressives are...in short...what's really wrong with the Democratic Party. That and the TDS thing...And afterall, that's really what this sub is about...isn't it."
116,fe1kei,"Are you being obtuse on purpose?  The Democratic Party can and should include people  who agree on even one of those issues, but youre attempting to exclude people who don't agree with you on all of these issues.  You're the reason we have a dimwit as Trump as president. Congrats."
117,fe1kei,Also this.
118,fe1kei,"Unfortunately, I’m in retail, margins are thin, and competition is fierce.  

By your measure, what’s my choice? Continue to run a losing business? Or should I close my doors, lay everyone off, and go back to my professional job, where i made a good living but employed no one? You act like I’m paying myself millions while squeezing my employees. This is far from the truth.  I’m struggling too. 

This reminds me of a conversation I had with a friend once, who was lauding my state’s efforts to reduce cigarette smoking by raising taxes on cigarettes. He seems to agree whole-heartedly with the proposition that artificially raising the price of something will reduce consumption of it. He had no response when I mentioned to him that the same thing was true with labor - if you artificially raise the price of it, businesses will consume less. We will invest in automation and get rid of the people.  This isn’t what I want, but if it’s what you want, you’re not the good person you think you are."
119,fe1kei,"Thank you for starting this thread.  I know you mean well, but reading the comments directed at me, it's now clear to me now that the Democrats are just as bad as Republicans with their purity tests and inability to handle dissenting opinions . 

Sadly, you and like-minded people (e.g., others who have posted in this thread) are responsible for someone like Trump being elected President.  Good job."
120,fe1kei,"Other than Medicare for all, which Biden has a different plan for what isn’t"
121,fe1kei,It's not enough to just vote Democrat. Picking one choice over the other is the difference between being able to afford medication or not. Voting for a Democrat is useless if they're pulling the party towards more conservative ideals.
122,fe1kei,Europe has had a National Health Care Service since the 1970s. Don't you think it's time we kind of got on board? It's been 30+ years. When will enough time have passed before it's ok for us to ask for a national healthcare system?
123,fe1kei,"Canada has a single-payer option and has 450 cases to our 5,000. They seem to be containing the virus.

So there are some countries with single-payer systems that work and some that could work better. What's your point?"
124,fe1kei,"Italy has, per capita, the highest number of elderly in the world. They were especially vulnerable to this."
